{
  "$schema": "./config.schema.json",
  "configName": "Dummy config",
  "inputFileName": "kungen.pdf",
  "outputFileName": "test_output.pdf",
  "actions": [
    {
      "action": "setMetadata",
      "title": "Alla kungens hästar, alla kungens män",
      "author": "Mikael Bergström",
      "description": "Forsta delen i en kampanj",
      "keywords": [
        "rotsystem",
        "cyberpunk",
        "kampanj"
      ]
    },
    {
      "action": "removeLayers",
      "layerNames": []
    },
    {
      "action": "deletePage",
      "pageNumber": 1
    },
    {
      "action": "addBlankPage",
      "beforePage": 2000
    },
    {
      "action": "addBlankPage",
      "beforePage": 1
    },
    {
      "action": "insertPages",
      "beforePage": 1,
      "sourceFile": "Omslag_separerade.pdf",
      "sourcePageRange": "1"
    },
    {
      "action": "renameLayerLabel",
      "from": "Alla kungens hästar, alla kungens män.indb",
      "to": "Alla Kungens Hästar"
    }
  ]
}